q_id, query, is_relevant, rel_words
ST_021, Falsche Fahrwarnung, No, triggered: data: collected: vehicles: sensors: systems: information: available: used: algorithms: sensitive: determined: accurately: result: activated
CT_021, Falsche Fahrwarnung, Yes, traffic: warning: view: warns: crossing: vehicles
ST_022, Wrong way driving warning, No, bosch: fahrassistent: automatischen: spurwechsel: geschwindigkeitsbereich: –: km/h: ergänzt: dafür: zusätzliche: überwachung: seitlichen: rückwärtigen: verkehrs: eck-radarsensoren: erforderlich: fahrer: signalisiert: betätigen: blinkers: wunsch: woraufhin: system: durchführt: sobald: gefahrlos: nebenspur: gewechselt: bleibt: dennoch: fahrverantwortung: fahrzeugführung: jederzeit: übernehmen
CT_022, Wrong way driving warning, No, querverkehrswarnung: erleichtert: versperrter: sicht: rückwärtige: ausparken: querparklücken: warnt: querenden: fahrzeugen
ST_023, Kreuzung sassistenten, Yes, complex: intersection: scenarios: dangerous: situations: impaired: visibility: stationary: traffic: buildings: v2x: warn: driver: approaching: outside: field: vision: warned: risk: collision: intersecting: vehicle: yielding
CT_023, Kreuzung sassistenten, No, 
ST_024, Electronic stability control, No, elektrolenkung: servolectric®: regelt: unterstützt: lenkung: fahrzeugen: mithilfe: elektronisch: gesteuerten: elektromotors: elektronische: schnittstelle: ermöglicht: fail-operational: ausführung: hochautomatisierte: fahren: gemäß: level: aufwärts
CT_024, Electronic stability control, Yes, elektronische: stabilitäts-programm: erkennt: schleuderbewegungen: fahrzeugs: wirkt: aktiv: entgegen
ST_025, Oxygen Sensors, No, skalierbare: fuel: cell: power: module: brennstoffzellensystem: stromerzeugung: fahrzeug: wasserstoff